{
  "intent_kind": "labels",
  "version": "1.0.0",
  "produced_by_skill_version": "arc-flash-labelling/1.0.1",
  "labels": [
    {
      "node_id": "MSB-1",
      "designation": "Main switchboard 2500A incomer",
      "format_applied": "bs_5499",
      "signal_word": "DANGER",
      "ppe_category": 3,
      "label_size_mm": {"width": 100, "height": 75},
      "qr_code_url": "https://buildtech.example/labels/MSB-1"
    },
    {
      "node_id": "MSB-1.DB-L1",
      "designation": "DB-L1 incoming sub-feeder 200A",
      "format_applied": "bs_5499",
      "signal_word": "WARNING",
      "ppe_category": 2,
      "label_size_mm": {"width": 100, "height": 75},
      "qr_code_url": "https://buildtech.example/labels/MSB-1.DB-L1"
    }
  ]
}
