{
  "intent_kind": "labels",
  "version": "1.0.0",
  "produced_by_skill_version": "arc-flash-labelling/1.0.0",
  "labels": [
    {
      "node_id": "MSB-1",
      "designation": "Main switchboard 1 — 11 kV 400A",
      "format_applied": "iso_7010",
      "signal_word": "DANGER",
      "ppe_category": 3,
      "label_size_mm": {"width": 100, "height": 75},
      "qr_code_url": "https://safetydb.europower.de/labels/MSB-1"
    },
    {
      "node_id": "DB-L1",
      "designation": "Distribution board Level 1 — 400V 200A",
      "format_applied": "iso_7010",
      "signal_word": "DANGER",
      "ppe_category": 3,
      "label_size_mm": {"width": 100, "height": 75},
      "qr_code_url": "https://safetydb.europower.de/labels/DB-L1"
    },
    {
      "node_id": "MV-SWB",
      "designation": "Medium voltage switchboard — 33 kV 315A compartment",
      "format_applied": "restricted_format",
      "signal_word": "RESTRICTED",
      "ppe_category": null,
      "label_size_mm": {"width": 100, "height": 75},
      "qr_code_url": "https://safetydb.europower.de/labels/MV-SWB"
    }
  ]
}
